{"campaign_id":"m2-representative-5x24","contract":"grid.public-history-campaign-request/v1","end_ms":1767225540000,"funding_page_limit":200,"funding_page_span_minutes":10080,"history_page_limit":1000,"kinds":["trade","mark","funding"],"lifecycle_policy":"registry-lifecycle-intersection-v1","max_attempts":3,"start_ms":1704067200000,"symbols":["BTCUSDT","UNIUSDT","FILUSDT","CHZUSDT","SUIUSDT"],"target_rps":15,"workers":24}
